09P0C0017A,豐原區-公有-環北站P,TXG33029464,平面小型車停車格27格（含身心障礙車位1格和孕婦及育兒車位1格）,1,1,24.25802,120.71924,臺中市豐原區圓環北路一段319號,24小時\,10元/半H,0,1,0,1,1,0,1,1,0,0,1,0,0,0,0,0,1,0,1,0,0,0,1,Taichung,TXG
12P0C0001A,清水區-公有-牛罵頭P,TXG27791884,平面停車場(身心障礙2格),1,1,24.27188,120.57673,臺中市清水區436台中市中山路231號,20元/時，月票1\,200元,1,1,0,1,0,0,1,0,0,1,1,0,0,0,0,0,1,1,0,0,0,0,1,Taichung,TXG
07P0C0003A,南屯區-公有-大新P  ,TXG28572633,平面場小型車43格(身心障礙1格),1,1,24.1499,120.65292,臺中市南屯區408台中市大墩十二街,20元/時,1,1,0,1,0,0,1,0,0,1,1,0,0,0,0,0,1,1,0,0,0,0,1,Taichung,TXG
02P0C0002A,東區-公有-(停61)十甲P,TXG33029464,小型車37格(含身障2格\,親子1格),1,1,24.14194,120.70571,臺中市東區東英八街二聖街口,24小時\,10元/半H  月租:1800元,0,1,0,1,0,0,1,1,0,1,1,1,0,0,0,0,1,1,1,0,0,0,1,Taichung,TXG
08P0C0009A,北屯區-公有-中興網球附設P,TXG80304384,平面式小型車(含身障車格2格、親子車格1格),1,1,24.17448,120.67613,臺中市北屯區瀋陽路一段、山西路二段口,計時：20元/時，當日最高收費120元,0,1,0,1,1,0,1,0,0,1,1,0,0,0,0,0,1,1,1,0,0,0,1,Taichung,TXG
28P0C0005A,大里區-公有-鳥竹圍公園P,TXG12745271,平面場小型車53格(身心障礙4格),1,1,24.11898,120.68716,臺中市大里區412台中市大智路676號,20元/時，月票1\,200元,1,1,0,1,0,0,1,0,0,1,1,0,0,0,0,0,1,1,0,0,0,0,1,Taichung,TXG
02P0C0010A,東區-公有-精武東P,TXG12745271,露天停車場(親子車格一格，無障礙車格一格),1,1,24.14807,120.7079,臺中市東區401台中市東英十七街與三賢街,半小時10元 無當日最高,0,1,0,1,1,0,1,1,0,0,1,0,0,0,0,0,0,1,0,0,0,0,1,Taichung,TXG
06P0C0009A,西屯區-公有-同心P  ,TXG28572633, 平面場小型車21格(身心障礙1格),1,1,24.17899,120.63749,407台中市西屯區黎明路三段212號旁,20元/時，月票1\,200元,1,1,0,1,0,0,1,0,0,1,1,0,0,0,0,0,1,1,0,0,0,0,1,Taichung,TXG
06P0C0006A,西屯區-公有-大鵬P  ,TXG28572633,平面場小型車16格(身心障礙1格),1,1,24.17557,120.6657,臺中市西屯區407台中市中清西二街,20元/時，月票1\,200元,1,1,0,1,0,0,1,0,0,1,1,0,0,0,0,0,0,1,0,0,0,0,1,Taichung,TXG
06P0C0016A,西屯區-公有-國豐P,TXG12745271,小型車68格，機車29,1,1,24.1924,120.61317,臺中市玉門路西平南巷交叉口與國安二路,10元/半小時,0,1,0,1,1,0,1,1,0,1,1,0,0,0,0,0,1,1,1,0,0,0,1,Taichung,TXG
13P0C0004B,沙鹿區-公有-沙田立體P,TXG89187210,小型車186格(含身心障礙汽車格位4格、親子車位4格)、機車92格(含身心障礙機車格位2格),2,1,24.2352,120.55907,臺中市沙鹿區興仁里16鄰沙田路116號,汽車15元/半小時，月票3000元/月；機車20元/次，月票200元/月。,0,1,0,1,1,0,1,0,0,0,0,0,0,0,0,0,1,1,0,0,0,1,0,Taichung,TXG
18P0C0004A,大雅區-公有-停六P,TXG64912334,汽車臨時停車每半小時新台幣15元 汽車月租每月每輛新台幣1\,200元整,1,1,24.21673,120.6661,臺中市大雅區雅潭路建興路交叉處,汽車臨時停車每半小時新台幣15元 汽車月租每月每輛新台幣1\,200元整,0,1,0,1,0,0,1,0,0,0,0,0,0,0,0,0,0,0,0,0,0,0,0,Taichung,TXG
07P0C0010A,南屯區-公有-馬祖P,TXG12745271,平面式小型車57格(含身障2格、親子1格)，機車32格(含身障2格、婦幼2格、1格充電),1,1,24.13442,120.61027,臺中市南屯區忠勇路19巷(彩虹眷村旁),計時:20/時，每30分鐘收費10元，以此類推，未滿30分鐘以30分鐘計，逾30分鐘以一小時計。,0,1,0,1,1,0,1,1,0,1,1,0,0,0,0,0,1,1,1,0,0,0,1,Taichung,TXG
18P0C0005A,大雅區-公有-中清雅潭P,TXG45124239,甲類（每小時20元或每次30元）標準內收費，即小型車計時20元/小時或計次30元/次內，前開費率如採計時應以半小時計價。 小型車月票1\,500元內,1,1,24.22112,120.64829,臺中市大雅區中清東路與雅潭路路口西側,甲類（每小時20元或每次30元）標準內收費，即小型車計時20元/小時或計次30元/次內，前開費率如採計時應以半小時計價。 小型車月票1\,500元內,0,1,0,1,0,0,0,0,0,0,1,1,0,0,0,0,0,0,0,0,0,0,1,Taichung,TXG
05P0C0016A,北區-公有-福音停車場,TXG12745271,平面停車,1,1,24.14683,120.68145,台中市北區精武路456號,20/時,0,1,0,1,1,0,1,0,0,0,0,0,0,0,0,0,0,0,0,0,0,0,0,Taichung,TXG
05P0C0007A,北區-公有-東欣P,TXG80304384,平面式小型車(含身障車格2格、親子車格1格),1,1,24.15339,120.67909,臺中市北區柳川西路四段、五義街,計時：10元/半小時,0,1,0,1,1,0,1,0,0,1,1,0,0,0,0,0,1,1,1,0,0,0,1,Taichung,TXG
06P0C0007A,西屯區-公有-太原P,TXG12745271,總車格數22格,1,1,24.16115,120.65968,臺中市西屯區太原路一段與忠義街,10元/半小時,0,1,0,1,1,0,1,0,0,0,0,0,0,0,0,0,0,0,0,0,0,0,0,Taichung,TXG
06P0C0028A,西屯區-公有-惠中停車場(A區),TXG12745271,小型車217格（含身心障礙５格）,1,1,24.16501,120.64669,臺中市西屯區407台中市惠中路99號,收費標準：(1)汽車臨時停車每半小時新台幣15元，停車時數未滿半小時者，以半小時計算收費。汽車月租每月每輛新台幣2\,400元整。(2)免收停車費車輛依據「臺中市公有停車場收費自治條例」辦理。,0,1,0,1,1,0,1,0,0,0,1,0,0,0,0,0,1,0,0,0,0,0,0,Taichung,TXG
08P0C0026A,北屯區-公有-(廣兼停8)竹興P,TXG12745271,平面式小型車125格(含身障 親子 電動車位),1,1,24.17588,120.70861,臺中市北屯區舊社里松竹五路一段與南興東路交叉口停車場,10/0.5小時,0,1,0,1,1,1,0,0,0,0,1,1,0,0,0,0,0,0,0,0,0,0,0,Taichung,TXG
05P0C0019C,北區-獎參-中正公園地下停車場,TXG16567240,立體停車場,3,2,24.15727,120.68118,臺中市北區學士路106號,計時：汽車４０元/小時。機車２０元/６小時。,0,1,0,1,1,0,1,0,0,0,0,0,0,0,0,0,0,0,0,0,0,0,0,Taichung,TXG
03P0C0010A,南區-公有-樹德P,TXG28877059,小型車72格(含身障停車格4格),1,1,24.11845,120.65406,402台中市南區德富路146巷,計時：10元/半小時,0,1,0,1,0,0,1,0,0,1,1,0,0,0,0,0,1,1,1,0,0,0,1,Taichung,TXG
28P0C0014A,大里區-公有-廣兼停八P   ,TXG12745271,平面場小型車156格(身心障礙4格),1,1,24.10246,120.6873,臺中市大里區412台中市德芳南路11號,20元/時，月票1\,200元,1,1,0,1,1,0,1,0,0,1,1,0,0,0,0,0,1,1,0,0,0,0,1,Taichung,TXG
09P0C0014A,豐原區-公有-博愛重劃區P11,TXG33029464,平停車場,1,1,24.24981,120.72168,臺中市豐原區南陽路488巷,免費,1,1,0,1,0,0,0,0,0,0,0,0,0,0,0,0,0,0,0,0,0,0,0,Taichung,TXG
09P0C0003A,豐原區-公有-田心路平面P,TXG53498197,小型車37格(含身障車格),1,1,24.23645,120.72317,豐原大道三段-田心路二段267南巷,20元/時,0,1,0,1,1,0,1,1,0,0,1,1,0,0,0,0,1,1,0,0,0,0,0,Taichung,TXG
06P0C0023A,西屯區-公有-福恩P,TXG12745271,全日,1,1,24.18245,120.61507,臺中市西屯區工業區一路2巷與工業區一路,10元/半小時,0,1,0,1,1,0,1,0,0,1,0,0,0,0,0,0,1,0,1,0,0,0,1,Taichung,TXG
18P0C0002A,大雅區-公有-三和公園附屬P,TXG83504040,三和公園附屬停車場：汽車停車位共16格(含身心障礙停車格1格),1,1,24.21237,120.66523,臺中市大雅區龍善二街193巷,甲類（每小時20元或每次30元），即小型車計時20元/小時或計次30元/次內，前開費率如採計時應以半小時計價。 小型車月票售價擬定上限每月1\,500元內。,0,1,0,1,0,0,1,0,0,0,1,1,1,0,0,0,1,0,0,0,0,0,0,Taichung,TXG
08P0C0027A,北屯區-公有-(廣停5)同榮P,TXG12745271,平面式小型車140格(含身障 親子 電動車位),1,1,24.1978,120.66421,臺中市北屯區同榮里新興路185巷與更生巷45弄交叉口停車場,10/0.5小時,0,1,0,1,1,1,1,1,0,0,1,1,0,0,0,0,0,0,0,0,0,0,0,Taichung,TXG
06P0C0011A,西屯區-公有-協和P  ,TXG12745271,平面式小型車73格(含身障2格),1,1,24.17683,120.62128,臺中市西屯區台中市安和二街165號,計時:20/時，每30分鐘收費10元，以此類推，未滿30分鐘以30分鐘計。,0,1,0,1,1,0,1,1,0,0,1,0,0,0,0,0,1,1,1,0,0,0,1,Taichung,TXG
04P0C0005A,西區-公有-民龍P,TXG80304384,平面式小型車25格(含身障2格、親子1格),1,1,24.15262,120.67022,民權路、博館二街,計時:20/時，每30分鐘收費10元，以此類推，未滿30分鐘以30分鐘計，逾30分鐘以一小時計。,0,1,0,1,0,0,1,1,0,0,1,0,0,0,0,0,1,1,1,0,0,0,1,Taichung,TXG
08P0C0004A,北屯區-公有-(細廣停2)中平P,TXG33029464,小型車17格(含身障2格\,親子1格),1,1,24.18527,120.66361,臺中市北屯區敦化路二段719號,24小時\,10元/半H,0,1,0,1,0,0,1,1,0,1,1,1,0,0,0,0,1,1,1,0,0,0,1,Taichung,TXG
05P0C0002A,北區-公有-中賓P,TXG80304384,小型車178格(含身心障礙車格4格),1,1,24.15466,120.68396,臺中市北區台中市五順街61號,小型車每小時新台幣 30 元整，停車時數一律以半小時計算。每 30 分鐘收費 15 元，以此類推，未滿 30 分鐘以 30 分鐘計，逾 30 分鐘以一小時計。汽車月租每月每輛新臺幣 2400 元整，另油電混合車停車 月票則半價優惠。,0,1,0,1,1,0,1,0,0,0,1,0,0,0,0,0,0,0,0,0,0,0,0,Taichung,TXG
28P0C0001C,大里區-公有-大里運動公園地下P,TXG12745271,地下停車場小型車960格(身心障礙22格)，機車357格,3,1,24.10065,120.68352,臺中市大里區412台中市勝利二路174號,20元/時，月票1\,800元,1,1,0,1,1,0,1,0,0,1,1,0,1,0,0,0,0,1,0,0,0,1,1,Taichung,TXG
03P0C0008A,南區-公有-復興P,TXG28877059,汽車9格(含身心障礙車格1格),1,1,24.13177,120.6765,臺中市南區402台中市復興路三段261號,計時：10元/半小時,0,1,0,1,0,0,1,0,0,1,1,0,0,0,0,0,1,1,1,0,0,0,1,Taichung,TXG
05P0C0008A,北區-公有-武昌P,TXG80304384,小型車21格(含身心障礙車格1格) 。,1,1,24.16936,120.66822,臺中市北區台中市陝西路59號,.小型車每小時新台幣 20 元整，停車時數一律以半小時計算。每 30 分鐘收費 10 元，以此類推，未滿 30 分鐘以 30 分鐘計，逾 30 分鐘以一小時計。汽車月租每月每輛新臺幣 1800 元整，另油電混合車停車 月票則半價優惠。,0,1,0,1,1,0,1,0,0,0,0,0,0,0,0,0,0,0,0,0,0,0,1,Taichung,TXG
08P0C0010A,北屯區-公有-仁德P,TXG82543299,小型車141 格(含身心障礙車格5 格、親子車格2 格)。,1,1,24.19045,120.6876,臺中市北屯區崇德12路與昌平東2路,小型車每小時新臺幣20 元，以半小時計費，如不逾三十分鐘者，以半小時計算； 如逾三十分鐘者，仍以一小時計算。汽車月租每月每輛新台幣600 元整。,0,1,0,1,1,0,0,0,0,0,0,0,0,0,0,0,0,0,0,0,0,0,0,Taichung,TXG
08P0C0023A,北屯區-公有-(細廣停2)太和P,TXG80304384,平面式小型車42格(含身障 親子 電動車位),1,1,24.16332,120.72523,臺中市西屯區北屯區太和路二段與太和二街交叉口停車場,10/0.5小時,0,1,0,1,1,0,1,1,0,0,1,1,0,0,0,0,0,1,0,0,0,0,0,Taichung,TXG
02P0M0001A,東區-公有-大智北機車P,TXG80682490,身障格2,1,1,24.13661,120.6879,臺中市東區大智北路、復興路四段,30分/5元，最高30,0,1,0,1,0,0,0,0,0,1,1,1,0,0,0,0,0,1,0,0,0,0,0,Taichung,TXG
06P0C0025A,西屯區-公有-銀聯三村P,TXG12745271,汽172，機97,1,1,24.16605,120.65824,臺中市西屯區銀聯一巷與甘州六街交叉口,10元/半小時,0,1,0,1,1,0,1,1,0,1,1,1,0,0,0,0,1,1,1,0,0,0,1,Taichung,TXG
04P0C0012C,西區-公有-萬壽棒球場附屬地下P,TXG80304384,小型車91格；1樓平面小型車9格(含身障車格2格)。,2,1,24.14629,120.64988,臺中市南屯區台中市西區向上路一段577號,小型車每小時新台幣 20 元整，停車時數一律以半小時計算。每 30 分鐘收費 10 元，以此類推，未滿 30 分鐘以 30 分鐘計，逾 30 分鐘以一小時計。汽車月租每月每輛新臺幣 1800 元整，另油電混合車停車 月票則半價優惠。,0,1,0,1,1,0,1,0,0,0,1,0,0,0,0,0,0,0,0,0,0,0,1,Taichung,TXG
09P0M0001A,豐原區-公有-橫街尾P,TXG33029464,平面式機車停車場,1,1,24.25049,120.71758,臺中市豐原區富春街,免費,1,1,0,1,0,0,0,0,0,0,0,0,0,0,0,0,0,0,0,0,0,0,0,Taichung,TXG
08P0C0016A,北屯區-公有-松竹P,TXG82543299,小型車每小時新臺幣20 元，以半小時計費，如不逾三十分鐘者，以半小時計算； 如逾三十分鐘者，仍以一小時計算。汽車月租每月每輛新台幣600 元整。,1,1,24.18032,120.68303,臺中市北屯區梅川東路5段與崇德6路,小型車每小時新臺幣20 元，以半小時計費，如不逾三十分鐘者，以半小時計算； 如逾三十分鐘者，仍以一小時計算。汽車月租每月每輛新台幣600 元整。,0,1,0,1,1,0,0,0,0,0,0,0,0,0,0,0,0,0,0,0,0,0,0,Taichung,TXG
06P0C0001B,西屯區-公有-(停71)漢口立體P,TXG10927578,汽車車格376(含身障車格:4格)，機車車格241格,1,1,24.16558,120.66164,臺中市西屯區寧夏路80號,40元/小時(進場未停滿半小時免收停車費) 汽車月租2\,400元,0,1,0,2,0,0,0,0,0,0,1,0,1,0,0,0,1,1,1,1,0,1,1,Taichung,TXG
05P0C0005A,北區-公有-育樂P,TXG80304384,平面式小型車(含身障車格2格、親子車格1格),1,1,24.15755,120.69181,臺中市北區雙十路、育樂街,計時：10元/半小時,0,1,0,1,1,0,1,0,0,1,1,0,0,0,0,0,1,1,1,0,0,0,1,Taichung,TXG
27P0C0007A,太平區-公有-長億P,TXG54619682,29,1,5,24.11971,120.72128,臺中市太平區長億里長義一街與長億路交叉口,1、小型車每半小時收費10元，未滿半小時以半小時計費。2、汽車月租車輛每月每輛新臺幣1500元。,0,1,0,1,0,0,1,0,0,0,1,1,0,0,0,0,1,1,1,0,0,1,1,Taichung,TXG
27P0C0006A,太平區-公有-新光廣停八P,TXG54619682,56,1,5,24.15888,120.71565,臺中市太平區育賢路與立功路口（賀緹酒店對面）,1、小型車每半小時收費10元，未滿半小時以半小時計費。2、汽車月租車輛每月每輛新臺幣1500元。,0,1,0,1,0,0,1,0,0,0,1,1,0,0,0,0,1,1,1,0,0,1,1,Taichung,TXG
27P0C0001A,太平區-公有-坪林森林附屬P,TXG25087904,平面式,1,1,24.1174,120.73715,臺中市中山路二段401號,每小時20元,0,1,0,1,0,0,1,0,0,0,1,0,0,0,0,0,0,1,1,0,0,1,1,Taichung,TXG
08P0C0021C,北屯區-公有-臺中市中央公園地下P,TXG80304384,小型車812格(含身障車格18格)，機車522格(含身障車格12格),3,1,24.17996,120.65807,臺中市北屯區經貿路一段159號,汽車計時:20/時，每30分鐘收費10元，以此類推，未滿30分鐘以30分鐘計，逾30分鐘以一小時計。機車當日每次20元。,0,1,0,1,0,0,1,1,0,1,1,0,1,0,0,0,1,1,1,0,0,1,1,Taichung,TXG
08P0C0022A,北屯區-公有-(廣兼停5)祥和P,TXG80304384,平面式小型車478格(含身障 親子 電動車位),1,1,24.16529,120.73251,臺中市北屯區太原路三段與建和路一段交叉口停車場,10/0.5小時,0,1,0,1,1,1,1,1,0,0,1,1,0,0,0,0,1,1,0,0,0,0,1,Taichung,TXG
03P0C0006A,南區-公有-國資圖P,TXG12745271,汽車：20元/時；平日最高收費100元/天,1,1,24.12927,120.67137,復興路三段與復興園路,機車:10元/次 ，汽車：20元/時；平日最高：100元,0,1,0,1,1,0,0,0,0,0,0,0,0,0,0,0,0,0,0,0,0,0,0,Taichung,TXG
07P0C0001A,南屯區-公有-三塊厝P,TXG80682490,平面戶外車位共計336格(含8身障6親子),1,1,24.14814,120.63265,臺中市南屯區台中市大墩十一街888號對面停車場,10/半小時 當日最高上限200,0,1,0,1,1,0,1,0,0,1,1,0,0,0,0,0,1,1,1,0,0,0,1,Taichung,TXG
05P0C0018A,北區-公有-永興停車場,TXG12745271,身障車格2 婦幼車格1格 充電車格1格,1,1,24.16542,120.68192,台中市北區太原路二段226號,每30分鐘收費10元，以此類推，未滿30分鐘以30分鐘計。,0,1,0,1,1,0,1,0,0,1,1,0,0,0,0,0,1,1,0,0,0,0,1,Taichung,TXG
03P0C0002A,南區-公有-南平P,TXG80304384,小型車75格(含身心障礙車格2格),1,1,24.12389,120.66576,臺中市南區南平路221號,小型車每小時新台幣 20 元整，停車時數一律以半小時計算。每 30 分鐘收費 10 元，以此類推，未滿 30 分鐘以 30 分鐘計，逾 30 分鐘以一小時計。汽車月租每月每輛新臺幣 1200 元整，另油電混合車停車 月票則半價優惠。,0,1,0,1,1,0,1,0,0,0,0,0,0,0,0,0,0,0,0,0,0,0,1,Taichung,TXG
24P0C0006C,大肚區-公所-大肚地下P,TXG28877059,汽車123格(含身障汽車格位3格)、機車54格(含身障機車格位2),3,1,24.1517,120.54614,臺中市大肚區自治路81號,汽車10元/半小時，月票1200元/月，機車免收費。,0,1,0,1,1,0,1,0,0,0,0,0,0,0,0,0,1,0,0,0,0,1,0,Taichung,TXG
02P0C0008A,東區-公有-信心P,TXG12745271,平面式小型車195格(含身障4格、親子3格),1,1,24.13416,120.70248,臺中市東區一心街、東英一街,計時:20/時，每30分鐘收費10元，以此類推，未滿30分鐘以30分鐘計，逾30分鐘以一小時計。,0,1,0,1,1,0,1,1,0,1,1,0,0,0,0,0,1,1,1,0,0,0,1,Taichung,TXG
28P0C0002A,大里區-公有-德芳興P,TXG12745271,平面場小型車15格(身心障礙1格),1,1,24.10412,120.67783,臺中市大里區412台中市德芳路二段28號,20元/時，月票1\,200元,1,1,0,1,0,0,1,0,0,1,1,0,0,0,0,0,1,1,0,0,0,0,1,Taichung,TXG
08P0C0003A,北屯區-公有-(細廣停1)景賢P,TXG33029464,小型車105格(含身障6格\,親子1格)\,機車44格(含身障2格),1,1,24.16667,120.73084,臺中市北屯區景賢路與太祥路路口,24小時\,10元/半H,0,1,0,1,0,0,1,0,0,1,1,1,0,0,0,0,1,1,1,0,0,0,1,Taichung,TXG
06P0C0022A,西屯區-公有-福安P,TXG12745271,總車格數37格（殘障車位1）,1,1,24.18599,120.61597,臺中市西屯區福科路與福科路557巷,10元/半小時,0,1,0,1,1,0,1,0,0,1,1,0,0,0,0,0,1,1,1,0,0,0,1,Taichung,TXG
02P0C0006A,東區-公有-旱溪P,TXG12745271,小型車178格,1,1,24.14057,120.69566,臺中市東區旱溪街、環中東路 四段,10元/半小時,0,1,0,1,1,0,0,1,0,0,0,0,0,0,0,0,0,0,0,0,0,0,0,Taichung,TXG
28P0C0013A,大里區-公有-廣兼停六P   ,TXG12745271,平面場小型車163格(身心障礙4格),1,1,24.11411,120.67616,臺中市大里區412台中市永隆七街89-65號,20元/時，月票1\,200元,1,1,0,1,0,0,1,0,0,1,1,0,0,0,0,0,1,1,0,0,0,0,1,Taichung,TXG
08P0C0029A,北屯區-公有-永和巷公園附屬停車場,TXG80682490,平面戶外車位共計65格(含2身障1親子),1,1,24.18019,120.67563,臺中市永和巷、山西路二段,10元/半小時 當日最高優惠120元,0,1,0,1,1,0,1,0,0,0,1,0,0,0,0,0,0,0,1,0,0,0,1,Taichung,TXG
07P0C0011A,南屯區-公有-惠文P,TXG80304384,平面式小型車310格(含身障7格、親子6格)、大型車14格、機車195格(含身障6格),1,1,24.14729,120.64385,臺中市南屯區惠文路、向上路二段,計時:20/時，每30分鐘收費10元，以此類推，未滿30分鐘以30分鐘計，逾30分鐘以一小時計。大型車雙倍計費。,0,1,0,1,0,0,1,1,0,0,1,0,0,0,0,0,1,1,1,0,0,0,1,Taichung,TXG
04P0C0013A,西區-公有-廣民P,TXG33029464,平面式小型車11格(含身障1格)、機車25格(含身障1格),1,1,24.13916,120.67361,臺中市西區四維街、大明街,計時:20/時，每30分鐘收費10元，以此類推，未滿30分鐘以30分鐘計，逾30分鐘以一小時計。,0,1,0,1,0,0,1,1,0,1,1,0,0,0,0,0,1,1,1,0,0,0,1,Taichung,TXG
09P0C0011A,豐原區-公有-葫蘆墩圳平面P9,TXG53498197,小型車45格(含身障車格),1,1,24.24819,120.7181,臺中市豐原區中興路-中興路29巷,20元/時,0,1,0,1,1,0,0,0,0,0,1,1,0,0,0,0,1,0,0,0,0,0,0,Taichung,TXG
07P0C0009A,南屯區-公有-春安P,TXG12745271,平面式小型車34格(含身障2格、親子1格、充電1格)、機車420格(含身障9格),1,1,24.13571,120.60742,臺中市南屯區建功路、春安三街,計時:20/時，每30分鐘收費10元，以此類推，未滿30分鐘以30分鐘計，逾30分鐘以一小時計。,0,1,0,1,1,0,1,1,0,1,1,0,0,0,0,0,1,1,1,0,0,0,1,Taichung,TXG
07P0C0006A,南屯區-公有-文昌P,TXG80304384,小型車24格(含身心障礙車格1格) ,1,1,24.1384,120.63618,臺中市南屯區文昌街199號,.小型車每小時新台幣 20 元整，停車時數一律以半小時計算。每 30 分鐘收費 10 元，以此類推，未滿 30 分鐘以 30 分鐘計，逾 30 分鐘以一小時計。汽車月租每月每輛新臺幣 1200 元整，另油電混合車停車 月票則半價優惠。,0,1,0,1,1,0,1,0,0,0,0,0,0,0,0,0,0,0,0,0,0,0,0,Taichung,TXG
28P0C0007A,大里區-公有-公六公園P,TXG12745271,平面場小型車30格(身心障礙1格),1,1,24.11274,120.6734,臺中市大里區412台中市永隆六街29號永隆區 活動中心前停車場,20元/時，月票1\,200元,1,1,0,1,0,0,1,0,0,1,1,0,0,0,0,0,1,1,0,0,0,0,1,Taichung,TXG
05P0C0003A,北區-公有-中德P,TXG12745271,平面式小型車29格(含身障1格、親子1格),1,1,24.16587,120.66933,臺中市北區太原四街、太原八街,計時:20/時，每30分鐘收費10元，以此類推，未滿30分鐘以30分鐘計，逾30分鐘以一小時計。,0,1,0,1,1,0,1,1,0,1,1,0,0,0,0,0,1,1,1,0,0,0,1,Taichung,TXG
04P0C0008A,西區-公有-林森P,TXG25087904,平面式,1,1,24.13441,120.67389,臺中市西區林森路33號,每小時20元,0,1,0,1,0,0,1,0,0,0,1,0,0,0,0,0,0,1,1,0,0,1,1,Taichung,TXG
08P0C0018A,北屯區-公有-軍功P,TXG50885758,平面式41格(含身障停車格2格),1,1,24.18203,120.71965,臺中市北屯區軍功路二段,計時:20元/小時，全程以半小時計費。,0,1,0,1,0,0,1,0,0,0,0,0,0,0,0,0,0,0,0,0,0,0,0,Taichung,TXG
06P0C0031A,西屯區-公有-中央公園南側P,TXG80304384,平面式小型車376格(含身障12格),1,1,24.1761,120.65509,臺中市西屯區河南路二段與甘肅路旁空地,計時:20/時，每30分鐘收費10元，以此類推，未滿30分鐘以30分鐘計，逾30分鐘以一小時計。,0,1,0,1,1,0,1,1,0,0,1,0,0,0,0,0,1,1,1,0,0,0,0,Taichung,TXG
09P0C0015A,豐原區-公有-博愛重劃區P3、5,TXG33029464,平停車場,1,1,24.25107,120.72151,臺中市豐原區博愛街3巷,免費,1,1,0,1,0,0,0,0,0,0,0,0,0,0,0,0,0,0,0,0,0,0,0,Taichung,TXG
07P0C0012A,南屯區-公有-新厝P,TXG80682490,平面式小型車130格(含2親子3身障),1,1,24.14576,120.62886,臺中市南屯區台中市益豐路四段338號對面停車場,10元/半小時 當日最高優惠120元,0,1,0,1,1,0,1,0,0,1,1,0,0,0,0,0,1,1,1,0,0,0,1,Taichung,TXG
27P0C0003B,太平區-公有-新平立體P,TXG82950746,立體式小型車196格,2,1,24.1492,120.7159,臺中市太平區樹孝路1號,20元,0,1,0,1,0,0,1,1,0,0,0,0,0,0,0,0,0,0,0,0,0,0,0,Taichung,TXG
07P0C0002A,南屯區-公有-大進P,TXG25087904,平面式,1,1,24.14184,120.64997,臺中市南屯區大墩五街187號,每小時20元,0,1,0,1,0,0,1,0,0,0,1,0,0,0,0,0,0,1,1,0,0,1,1,Taichung,TXG
06P0C0032C,西屯區-公有-市政公園地下停車場,TXG80738683,地下停車場,3,1,24.15901,120.64708,臺中市西屯區407台中市惠中路一段99號,計時：10元/時，全程以半小時計費,0,1,0,1,1,1,1,0,0,1,0,1,1,0,0,0,0,1,0,0,0,1,1,Taichung,TXG
28P0C0006A,大里區-公有-國光公園P,TXG12745271,平面場小型車29格(身心障礙1格),1,1,24.11652,120.67745,臺中市大里區412台中市興大南街39號,20元/時，月票1\,200元,1,1,0,1,0,0,1,0,0,1,1,0,0,0,0,0,1,1,0,0,0,0,1,Taichung,TXG
04P0C0010A,西區-公有-美村P,TXG80304384,平面式小型車101格(含身障3格、親子2格),1,1,24.14143,120.66166,臺中市西區美村路、存中街口,計時:20/時，每30分鐘收費10元，以此類推，未滿30分鐘以30分鐘計，逾30分鐘以一小時計。,0,1,0,1,0,0,1,1,0,0,1,0,0,0,0,0,1,1,1,0,0,0,1,Taichung,TXG
07P0C0016A,南屯區-公有-豐功P,TXG82543299,小型車97 格(含身心障礙車格3 格、親子車格1 格)。,1,1,24.13343,120.64396,臺中市南屯區向心南路與文心南三路,小型車每小時新臺幣20 元，以半小時計費，如不逾三十分鐘者，以半小時計算； 如逾三十分鐘者，仍以一小時計算。汽車月租每月每輛新台幣1200 元整。,0,1,0,1,1,0,0,0,0,0,0,0,0,0,0,0,0,0,0,0,0,0,0,Taichung,TXG
26P0C0001C,霧峰區-公所-本堂公園地下P,TXG12745271,地下停車場,3,1,24.05954,120.69952,臺中市霧峰區成功路222-226號,20元/時,0,1,0,1,1,0,1,0,0,0,1,1,1,0,0,0,1,1,1,0,0,1,0,Taichung,TXG
09P0C0006A,豐原區-公有-葫蘆墩圳平面P4,TXG53498197,小型車60格(含身障車格),1,1,24.25266,120.71986,臺中市豐原區和平街-新生北路,30元/時,0,1,0,1,1,0,0,0,0,0,1,1,0,0,0,0,1,1,0,0,0,0,0,Taichung,TXG
02P0C0009B,東區-公有-南京立體P,TXG12745271,小型車774格(含身障車格),2,1,24.14012,120.69062,臺中市東區南京路72號,20元/時,0,1,0,1,1,1,1,1,0,0,1,1,0,0,0,0,1,1,0,0,0,1,0,Taichung,TXG
17P0C0003B,潭子區-公有-潭興立體停車場,TXG80304384,立體停車場,2,1,24.21131,120.70416,台中市潭子區潭興路三段25號,15元/半小時，平日12小時最高150元，假日12小時最高200元,0,1,1,1,1,0,1,1,0,1,1,0,1,0,0,0,1,1,0,0,0,1,1,Taichung,TXG
08P0C0019A,北屯區-公有-軍福P,TXG50885758,平面式36格(含身障停車格1格),1,1,24.17825,120.71541,台中市北屯區松竹三路2號,計時:20元/小時，全程以半小時計費,0,1,0,1,0,0,1,0,0,0,1,0,0,0,0,0,1,1,0,0,0,0,1,Taichung,TXG
06P0C0026A,西屯區-公有-櫻花P  ,TXG28572633,平面場小型車21格(身心障礙1格)，機車17格(身心障礙1格),1,1,24.17005,120.65212,407台中市西屯區櫻花路,20元/時，月票1\,200元,1,1,0,1,0,0,1,0,0,1,1,0,0,0,0,0,0,1,0,0,0,0,1,Taichung,TXG
08P0C0020A,北屯區-公有-雷中P,TXG50885758,小型車23格(含身障停車格1格),1,1,24.18272,120.66877,臺中市西屯區406台中市北屯區雷中街32-1號,計時：10元/半小時,0,1,0,1,0,0,1,0,0,1,1,0,0,0,0,0,1,1,1,0,0,0,1,Taichung,TXG
02P0C0005B,東區-公有-干城立體P,TXG12745271,立體式小型車478格(含身障 親子 電動車位),2,1,24.14296,120.68776,臺中市東區台中市自由路三段50號,10/0.5小時,0,1,0,1,0,1,1,0,0,1,1,1,1,0,0,0,1,1,1,1,0,1,1,Taichung,TXG
