995,輔仁,12681939,大型車格數0格\,小型車格數27格\,機車格數40格\,腳踏車格數0格\,身心障礙汽車格數0格\,身心障礙機車格數0格,1,1,22.6254,120.33202,高雄市苓雅區輔仁路&輔仁路89巷,計次30元/6小時,0,1,0,2,0,0,0,0,0,0,0,0,0,0,0,0,0,1,0,0,0,1,0,Kaohsiung,KHH
467,慈惠六街,15756996,大型車格數0格\,小型車格數119格\,機車格數0格\,腳踏車格數0格\,身心障礙汽車格數0格\,身心障礙機車格數0格,1,1,22.67448,120.3514,高雄市仁武區赤勇三街近慈惠五街,計次30元/6小時,0,1,0,2,0,0,0,0,0,0,0,0,0,0,0,0,0,1,0,0,0,1,0,Kaohsiung,KHH
ZZ3,小港轉運站自行車立體停車場,80682490,大型車格數0格\,小型車格數0格\,機車格數0格\,腳踏車格數0格\,身心障礙汽車格數0格\,身心障礙機車格數0格,2,1,22.56431,120.35409,小港轉運站旁,免費,0,1,0,2,0,0,0,0,0,0,0,0,0,0,0,0,0,1,0,0,0,1,0,Kaohsiung,KHH
968,河川,12681939,大型車格數0格\,小型車格數22格\,機車格數11格\,腳踏車格數0格\,身心障礙汽車格數0格\,身心障礙機車格數0格,1,1,22.63513,120.28381,高雄市鼓山區河川街、綠川街口,計次30元/6小時,0,1,0,2,0,0,0,0,0,0,0,0,0,0,0,0,0,1,0,0,0,1,0,Kaohsiung,KHH
AD16,岡山(立體),15756996,大型車格數0格\,小型車格數154格\,機車格數0格\,腳踏車格數0格\,身心障礙汽車格數0格\,身心障礙機車格數0格,2,1,22.80251,120.30206,高雄市岡山區岡山鎮大仁北路3號,計次20元、月票900元,0,1,0,2,0,0,0,0,0,0,0,0,0,0,0,0,0,1,0,0,0,1,0,Kaohsiung,KHH
814b,鳳山捷運站機車,15756996,大型車格數0格\,小型車格數0格\,機車格數172格\,腳踏車格數10格\,身心障礙汽車格數0格\,身心障礙機車格數0格,1,1,22.62585,120.3563,高雄市鳳山區捷運鳳山站旁,不收費,0,1,0,2,0,0,0,0,0,0,0,0,0,0,0,0,0,1,0,0,0,1,0,Kaohsiung,KHH
E36,民富,15756996,大型車格數0格\,小型車格數35格\,機車格數22格\,腳踏車格數0格\,身心障礙汽車格數0格\,身心障礙機車格數0格,1,1,22.85403,120.26285,高雄市路竹區民強街交叉口,計次30元/6小時,0,1,0,2,0,0,0,0,0,0,0,0,0,0,0,0,0,1,0,0,0,1,0,Kaohsiung,KHH
471,金興,15756996,大型車格數0格\,小型車格數142格\,機車格數0格\,腳踏車格數0格\,身心障礙汽車格數0格\,身心障礙機車格數0格,1,1,22.89605,120.18492,高雄市茄萣區金鑾路、仁愛路,計次30元/6小時,0,1,0,2,0,0,0,0,0,0,0,0,0,0,0,0,0,1,0,0,0,1,0,Kaohsiung,KHH
716,勞工公園(勞一),50885758,大型車格數0格\,小型車格數198格\,機車格數292格\,腳踏車格數0格\,身心障礙汽車格數0格\,身心障礙機車格數0格,1,1,22.65056,120.35871,高雄市鳥松區長庚路北側,計時15元/半小時,0,1,0,2,0,0,0,0,0,0,0,0,0,0,0,0,0,1,0,0,0,1,0,Kaohsiung,KHH
Z08,泰安,15756996,大型車格數10格\,小型車格數61格\,機車格數0格\,腳踏車格數0格\,身心障礙汽車格數0格\,身心障礙機車格數0格,1,1,22.90271,120.54202,A區：高雄客運對面泰安路旁。 B區：中山路一段與建美路口。,不收費,0,1,0,2,0,0,0,0,0,0,0,0,0,0,0,0,0,1,0,0,0,1,0,Kaohsiung,KHH
135,臨海二路,12681939,大型車格數0格\,小型車格數12格\,機車格數30格\,腳踏車格數0格\,身心障礙汽車格數0格\,身心障礙機車格數0格,1,1,22.62134,120.27447,高雄市鼓山區臨海二路、捷興街口,平日計時15元/半小時，假日計時20元/半小時,0,1,0,2,0,0,0,0,0,0,0,0,0,0,0,0,0,1,0,0,0,1,0,Kaohsiung,KHH
857e,小港鳳陽,15756996,大型車格數0格\,小型車格數20格\,機車格數0格\,腳踏車格數0格\,身心障礙汽車格數0格\,身心障礙機車格數0格,1,1,22.56248,120.37022,高雄市小港區鳳陽街18巷、6巷中間,不收費,0,1,0,2,0,0,0,0,0,0,0,0,0,0,0,0,0,1,0,0,0,1,0,Kaohsiung,KHH
A22,後昌,12745271,大型車格數0格\,小型車格數13格\,機車格數10格\,腳踏車格數0格\,身心障礙汽車格數0格\,身心障礙機車格數0格,1,1,22.71242,120.29452,後昌路862之1號旁,計時15元/半小時,0,1,0,2,0,0,0,0,0,0,0,0,0,0,0,0,0,1,0,0,0,1,0,Kaohsiung,KHH
Z03a,大愛園區,15756996,大型車格數27格\,小型車格數120格\,機車格數0格\,腳踏車格數0格\,身心障礙汽車格數0格\,身心障礙機車格數0格,1,1,22.96936,120.54251,高雄市杉林區杉林國中斜對面,不收費,0,1,0,2,0,0,0,0,0,0,0,0,0,0,0,0,0,1,0,0,0,1,0,Kaohsiung,KHH
813c,五甲停三機車,15756996,大型車格數0格\,小型車格數0格\,機車格數91格\,腳踏車格數0格\,身心障礙汽車格數0格\,身心障礙機車格數0格,1,1,22.61467,120.34714,高雄市鳳山區凱旋路&凱旋路341巷,不收費,0,1,0,2,0,0,0,0,0,0,0,0,0,0,0,0,0,1,0,0,0,1,0,Kaohsiung,KHH
918,舊左營國中,15756996,大型車格數0格\,小型車格數142格\,機車格數0格\,腳踏車格數0格\,身心障礙汽車格數0格\,身心障礙機車格數0格,1,1,22.67795,120.29324,高雄市左營區新庄仔路、勝利路,計次30元/6小時,0,1,0,2,0,0,0,0,0,0,0,0,0,0,0,0,0,1,0,0,0,1,0,Kaohsiung,KHH
AD27,高雄國際會議中心立體停車場,15756996,大型車格數0格\,小型車格數209格\,機車格數0格\,腳踏車格數0格\,身心障礙汽車格數0格\,身心障礙機車格數0格,2,1,22.62661,120.28552,高雄市鹽埕區中正四路274號,,0,1,0,2,0,0,0,0,0,0,0,0,0,0,0,0,0,1,0,0,0,1,0,Kaohsiung,KHH
914,福誠,12681939,大型車格數0格\,小型車格數46格\,機車格數52格\,腳踏車格數0格\,身心障礙汽車格數0格\,身心障礙機車格數0格,1,1,22.59367,120.32337,高雄市鳳山區福誠三街、福誠五街,計次30元/6小時,0,1,0,2,0,0,0,0,0,0,0,0,0,0,0,0,0,1,0,0,0,1,0,Kaohsiung,KHH
AD20,高雄十全,80304384,大型車格數0格\,小型車格數208格\,機車格數0格\,腳踏車格數0格\,身心障礙汽車格數0格\,身心障礙機車格數0格,2,1,22.64512,120.31587,高雄市三民區十全路6號,當日最高上限120元,0,1,0,2,0,0,0,0,0,0,0,0,0,0,0,0,0,1,0,0,0,1,0,Kaohsiung,KHH
813b,五甲停二機車,15756996,大型車格數0格\,小型車格數0格\,機車格數42格\,腳踏車格數0格\,身心障礙汽車格數0格\,身心障礙機車格數0格,1,1,22.61845,120.35313,高雄市鳳山區國昌路與國光路口,不收費,0,1,0,2,0,0,0,0,0,0,0,0,0,0,0,0,0,1,0,0,0,1,0,Kaohsiung,KHH
AD15,林園(立體),12745271,大型車格數0格\,小型車格數244格\,機車格數0格\,腳踏車格數0格\,身心障礙汽車格數0格\,身心障礙機車格數0格,2,1,22.502,120.39573,高雄市林園區林園南路77號,計時10元、月票800元,0,1,0,2,0,0,0,0,0,0,0,0,0,0,0,0,0,1,0,0,0,1,0,Kaohsiung,KHH
836,金鼎段(仁武),15756996,大型車格數0格\,小型車格數79格\,機車格數0格\,腳踏車格數0格\,身心障礙汽車格數0格\,身心障礙機車格數0格,1,1,22.67602,120.33674,高雄市仁武區大豐路及大春路口,計次30元/6小時,0,1,0,2,0,0,0,0,0,0,0,0,0,0,0,0,0,1,0,0,0,1,0,Kaohsiung,KHH
937,管仲,15756996,大型車格數0格\,小型車格數229格\,機車格數51格\,腳踏車格數0格\,身心障礙汽車格數0格\,身心障礙機車格數0格,1,1,22.60461,120.31377,高雄市前鎮區管仲路、光華三路,計次30元/6小時,0,1,0,2,0,0,0,0,0,0,0,0,0,0,0,0,0,1,0,0,0,1,0,Kaohsiung,KHH
C93,凱旋四路,15756996,大型車格數0格\,小型車格數150格\,機車格數61格\,腳踏車格數0格\,身心障礙汽車格數3格\,身心障礙機車格數2格,1,1,22.5942,120.3114,前鎮區凱旋四路、鎮興路口,計時15元/半小時,0,1,0,2,0,0,0,0,0,0,0,0,0,0,0,0,0,1,0,0,0,1,0,Kaohsiung,KHH
C45,高楠公路,80304384,大型車格數0格\,小型車格數99格\,機車格數0格\,腳踏車格數0格\,身心障礙汽車格數0格\,身心障礙機車格數0格,1,1,22.73158,120.32057,楠梓區高楠公路1872巷,計次30元/6小時,0,1,0,2,0,0,0,0,0,0,0,0,0,0,0,0,0,1,0,0,0,1,0,Kaohsiung,KHH
C96,龍江公園,80304384,大型車格數0格\,小型車格數28格\,機車格數47格\,腳踏車格數0格\,身心障礙汽車格數1格\,身心障礙機車格數0格,1,1,22.63989,120.30836,高雄市三民區龍江街、復興一路口,計時15元/半小時,0,1,0,2,0,0,0,0,0,0,0,0,0,0,0,0,0,1,0,0,0,1,0,Kaohsiung,KHH
924,旗津海岸,15756996,大型車格數22格\,小型車格數92格\,機車格數0格\,腳踏車格數0格\,身心障礙汽車格數0格\,身心障礙機車格數0格,1,1,22.60868,120.26927,高雄市旗津區旗津海水浴場旁,小型車週五至週日及國定假日計時25元/半小時，週一至週四計次50元/6小時；大型車週五至週日及國定假日第1小時，每30分鐘收費50元，第2小時起(含)每30分鐘收費100元\,週一至週四計次100元/6小時,0,1,0,2,0,0,0,0,0,0,0,0,0,0,0,0,0,1,0,0,0,1,0,Kaohsiung,KHH
852,辛亥,12745271,大型車格數0格\,小型車格數43格\,機車格數0格\,腳踏車格數0格\,身心障礙汽車格數0格\,身心障礙機車格數0格,1,1,22.6648,120.31005,高雄市左營區裕誠路、辛亥路,計時15元/半小時,0,1,0,2,0,0,0,0,0,0,0,0,0,0,0,0,0,1,0,0,0,1,0,Kaohsiung,KHH
832,榮光,12745271,大型車格數0格\,小型車格數26格\,機車格數24格\,腳踏車格數0格\,身心障礙汽車格數0格\,身心障礙機車格數0格,1,1,22.68496,120.3216,高雄市左營區榮光街與榮總路,計時15元/半小時,0,1,0,2,0,0,0,0,0,0,0,0,0,0,0,0,0,1,0,0,0,1,0,Kaohsiung,KHH
828,常順,12745271,大型車格數0格\,小型車格數78格\,機車格數0格\,腳踏車格數0格\,身心障礙汽車格數0格\,身心障礙機車格數0格,1,1,22.73217,120.33701,高雄市楠梓區常順街、常德街32巷,計次30元/6小時,0,1,0,2,0,0,0,0,0,0,0,0,0,0,0,0,0,1,0,0,0,1,0,Kaohsiung,KHH
458,竹後段,50885758,大型車格數0格\,小型車格數36格\,機車格數0格\,腳踏車格數0格\,身心障礙汽車格數0格\,身心障礙機車格數0格,1,1,22.70641,120.33723,高雄市仁武區水管路北側、竹後社區活動中心旁,計次30元/6小時,0,1,0,2,0,0,0,0,0,0,0,0,0,0,0,0,0,1,0,0,0,1,0,Kaohsiung,KHH
818,觀湖,12681939,大型車格數0格\,小型車格數80格\,機車格數0格\,腳踏車格數0格\,身心障礙汽車格數0格\,身心障礙機車格數0格,1,1,22.65546,120.36008,公園路近山明街（消防局旁）,計次30元/6小時,0,1,0,2,0,0,0,0,0,0,0,0,0,0,0,0,0,1,0,0,0,1,0,Kaohsiung,KHH
864,店北,80682490,大型車格數0格\,小型車格數21格\,機車格數0格\,腳踏車格數0格\,身心障礙汽車格數0格\,身心障礙機車格數0格,1,1,22.56274,120.35152,高雄市小港區店北路、店鳳街,計次30元/6小時,0,1,0,2,0,0,0,0,0,0,0,0,0,0,0,0,0,1,0,0,0,1,0,Kaohsiung,KHH
AD2,民權輕鋼架(立體),80304384,大型車格數0格\,小型車格數256格\,機車格數203格\,腳踏車格數0格\,身心障礙汽車格數0格\,身心障礙機車格數0格,2,1,22.62372,120.31161,高雄市新興區民權一路221號,計時30元、月票：里民1500元、一般民眾日間2100元、一般民眾夜間600元、一般全日2700元,0,1,0,2,0,0,0,0,0,0,0,0,0,0,0,0,0,1,0,0,0,1,0,Kaohsiung,KHH
814a,鳳山轉運站機車,15756996,大型車格數0格\,小型車格數0格\,機車格數102格\,腳踏車格數0格\,身心障礙汽車格數0格\,身心障礙機車格數0格,1,1,22.62612,120.3636,鳳山轉運站北側&大東公園西側,不收費,0,1,0,2,0,0,0,0,0,0,0,0,0,0,0,0,0,1,0,0,0,1,0,Kaohsiung,KHH
938,光華,15756996,大型車格數0格\,小型車格數212格\,機車格數0格\,腳踏車格數0格\,身心障礙汽車格數0格\,身心障礙機車格數0格,1,1,22.60681,120.31683,高雄市前鎮區光華三路、ㄧ心一路203巷,計次30元/6小時,0,1,0,2,0,0,0,0,0,0,0,0,0,0,0,0,0,1,0,0,0,1,0,Kaohsiung,KHH
Z05,烏樹林,15756996,大型車格數0格\,小型車格數12格\,機車格數0格\,腳踏車格數0格\,身心障礙汽車格數0格\,身心障礙機車格數0格,1,1,22.81787,120.22452,高雄市永安區公所對面,計次30元/6小時,0,1,0,2,0,0,0,0,0,0,0,0,0,0,0,0,0,1,0,0,0,1,0,Kaohsiung,KHH
855,高雄明仁,12745271,大型車格數0格\,小型車格數111格\,機車格數0格\,腳踏車格數0格\,身心障礙汽車格數0格\,身心障礙機車格數0格,1,1,22.66266,120.31319,高雄市三民區明仁路與明吉路口,12小時150元,0,1,0,2,0,0,0,0,0,0,0,0,0,0,0,0,0,1,0,0,0,1,0,Kaohsiung,KHH
812,柴山機車,15756996,大型車格數0格\,小型車格數0格\,機車格數150格\,腳踏車格數0格\,身心障礙汽車格數0格\,身心障礙機車格數3格,1,1,22.65416,120.27438,鼓山區青泉街、青泉街126巷口,不收費,0,1,0,2,0,0,0,0,0,0,0,0,0,0,0,0,0,1,0,0,0,1,0,Kaohsiung,KHH
290,公園路,12681939,大型車格數30格\,小型車格數346格\,機車格數251格\,腳踏車格數0格\,身心障礙汽車格數0格\,身心障礙機車格數0格,1,1,22.61951,120.28533,高雄市鹽埕區公園二路、大義街口,小型車平日計次50元/6小時 假日：計時15元/半小時；大客車計時30元/半小時,0,1,0,2,0,0,0,0,0,0,0,0,0,0,0,0,0,1,0,0,0,1,0,Kaohsiung,KHH
A30,後昌路北側,15756996,大型車格數0格\,小型車格數0格\,機車格數58格\,腳踏車格數0格\,身心障礙汽車格數0格\,身心障礙機車格數0格,254,1,22.70798,120.30107,左楠路與後昌路546巷,不收費,0,1,0,2,0,0,0,0,0,0,0,0,0,0,0,0,0,1,0,0,0,1,0,Kaohsiung,KHH
AD3,高雄忠孝,80304384,大型車格數0格\,小型車格數568格\,機車格數0格\,腳踏車格數0格\,身心障礙汽車格數0格\,身心障礙機車格數0格,2,1,22.63339,120.30605,高雄市新興區忠孝一路331號,24小時150,0,1,0,2,0,0,0,0,0,0,0,0,0,0,0,0,0,1,0,0,0,1,0,Kaohsiung,KHH
923,南鼓山,12681939,大型車格數0格\,小型車格數28格\,機車格數0格\,腳踏車格數0格\,身心障礙汽車格數0格\,身心障礙機車格數0格,1,1,22.62161,120.27463,高雄市鼓山區臨海二路、捷興二街,平日計時15元/半小時 假日計時20元/半小時,0,1,0,2,0,0,0,0,0,0,0,0,0,0,0,0,0,1,0,0,0,1,0,Kaohsiung,KHH
590,時代大道,15756996,大型車格數0格\,小型車格數48格\,機車格數0格\,腳踏車格數0格\,身心障礙汽車格數1格\,身心障礙機車格數0格,1,1,22.59641,120.30894,高雄市前鎮區中華五路與時代大道口,計時15元/半小時,0,1,0,2,0,0,0,0,0,0,0,0,0,0,0,0,0,1,0,0,0,1,0,Kaohsiung,KHH
560,旗津老街,15756996,大型車格數0格\,小型車格數105格\,機車格數0格\,腳踏車格數0格\,身心障礙汽車格數0格\,身心障礙機車格數0格,1,1,22.61051,120.2681,高雄市旗津區旗津三路與發祥街口,週五至週日及國定假日計時25元/半小時；週一至週四計次50元/6小時,0,1,0,2,0,0,0,0,0,0,0,0,0,0,0,0,0,1,0,0,0,1,0,Kaohsiung,KHH
846,仁慈公園,15756996,大型車格數0格\,小型車格數35格\,機車格數0格\,腳踏車格數0格\,身心障礙汽車格數0格\,身心障礙機車格數0格,1,1,22.67156,120.359,高雄市仁武區仁慈公園旁,計次30元/6小時,0,1,0,2,0,0,0,0,0,0,0,0,0,0,0,0,0,1,0,0,0,1,0,Kaohsiung,KHH
460b,蚵仔寮（B區）,15756996,大型車格數0格\,小型車格數62格\,機車格數0格\,腳踏車格數0格\,身心障礙汽車格數0格\,身心障礙機車格數0格,1,1,22.72692,120.2571,高雄市梓官區中正路75號後方,不收費,0,1,0,2,0,0,0,0,0,0,0,0,0,0,0,0,0,1,0,0,0,1,0,Kaohsiung,KHH
843,大樹舊鐵橋,15756996,大型車格數0格\,小型車格數154格\,機車格數0格\,腳踏車格數0格\,身心障礙汽車格數0格\,身心障礙機車格數0格,1,1,22.66542,120.42751,大樹舊鐵橋濕地生態公園園區內西北側(既有停車場之北側；因位於高屏溪河川公地上，故無地號),不收費,0,1,0,2,0,0,0,0,0,0,0,0,0,0,0,0,0,1,0,0,0,1,0,Kaohsiung,KHH
812b,成功機車,15756996,大型車格數0格\,小型車格數0格\,機車格數57格\,腳踏車格數0格\,身心障礙汽車格數0格\,身心障礙機車格數0格,1,1,22.6271,120.29278,高雄市前金區成功一路、前金二街,不收費,0,1,0,2,0,0,0,0,0,0,0,0,0,0,0,0,0,1,0,0,0,1,0,Kaohsiung,KHH
947,仁和公園,12745271,大型車格數0格\,小型車格數55格\,機車格數0格\,腳踏車格數0格\,身心障礙汽車格數0格\,身心障礙機車格數0格,1,1,22.681,120.35246,高雄市仁武區仁和公園內,計次30元/6小時,0,1,0,2,0,0,0,0,0,0,0,0,0,0,0,0,0,1,0,0,0,1,0,Kaohsiung,KHH
C92,二聖,12745271,大型車格數0格\,小型車格數120格\,機車格數0格\,腳踏車格數0格\,身心障礙汽車格數0格\,身心障礙機車格數0格,1,1,22.6121,120.32823,高雄市鳳山區二聖路&近凱旋三路,計時15元/半小時,0,1,0,2,0,0,0,0,0,0,0,0,0,0,0,0,0,1,0,0,0,1,0,Kaohsiung,KHH
547,八德小型車,12745271,大型車格數0格\,小型車格數122格\,機車格數0格\,腳踏車格數0格\,身心障礙汽車格數0格\,身心障礙機車格數0格,1,1,22.68122,120.34028,高雄市仁武區八德南路與京吉一路口,計次30元/6小時,0,1,0,2,0,0,0,0,0,0,0,0,0,0,0,0,0,1,0,0,0,1,0,Kaohsiung,KHH
106,中崙,12681939,大型車格數0格\,小型車格數150格\,機車格數0格\,腳踏車格數0格\,身心障礙汽車格數0格\,身心障礙機車格數0格,1,1,22.60365,120.35252,高雄市鳳山區中崙二路&中崙三路口,計次30元/6小時,0,1,0,2,0,0,0,0,0,0,0,0,0,0,0,0,0,1,0,0,0,1,0,Kaohsiung,KHH
A14,鎮榮(含第二),80682490,大型車格數0格\,小型車格數28格\,機車格數0格\,腳踏車格數0格\,身心障礙汽車格數0格\,身心障礙機車格數0格,1,1,22.58873,120.3097,高雄市前鎮區鎮榮街、鎮華街,計次30元/6小時,0,1,0,2,0,0,0,0,0,0,0,0,0,0,0,0,0,1,0,0,0,1,0,Kaohsiung,KHH
D91,清安,15756996,大型車格數0格\,小型車格數58格\,機車格數0格\,腳踏車格數0格\,身心障礙汽車格數0格\,身心障礙機車格數0格,1,1,22.73742,120.33861,高雄市楠梓區清安街29號旁,計次30元/6小時,0,1,0,2,0,0,0,0,0,0,0,0,0,0,0,0,0,1,0,0,0,1,0,Kaohsiung,KHH
838,澄觀段停八,80304384,大型車格數0格\,小型車格數66格\,機車格數0格\,腳踏車格數0格\,身心障礙汽車格數2格\,身心障礙機車格數0格,1,1,22.6791,120.33469,高雄市仁武區京富路、京文街口,計次30元/6小時,0,1,0,2,0,0,0,0,0,0,0,0,0,0,0,0,0,1,0,0,0,1,0,Kaohsiung,KHH
913,新光,15756996,大型車格數15格\,小型車格數892格\,機車格數578格\,腳踏車格數0格\,身心障礙汽車格數19格\,身心障礙機車格數0格,1,1,22.60633,120.30054,復興三路、成功二路口,大客車平日30元/半小時\,週六日及國定假日40元/半小時;小型車平日15元/半小時\,週六日及國定假日20元/半小時；機車平日15元/日.次\,週六日及國定假日30元/日.次,0,1,0,2,0,0,0,0,0,0,0,0,0,0,0,0,0,1,0,0,0,1,0,Kaohsiung,KHH
c50,長壽路,15756996,大型車格數0格\,小型車格數28格\,機車格數13格\,腳踏車格數0格\,身心障礙汽車格數0格\,身心障礙機車格數0格,1,1,22.88473,120.24257,湖內區長春四街18號對面,計次30元/6小時,0,1,0,2,0,0,0,0,0,0,0,0,0,0,0,0,0,1,0,0,0,1,0,Kaohsiung,KHH
955,南成,12681939,大型車格數0格\,小型車格數73格\,機車格數0格\,腳踏車格數0格\,身心障礙汽車格數0格\,身心障礙機車格數0格,1,1,22.59056,120.33833,高雄市鳳山區南和一路與和成路,計次30元/6小時,0,1,0,2,0,0,0,0,0,0,0,0,0,0,0,0,0,1,0,0,0,1,0,Kaohsiung,KHH
844,大社停一,15756996,大型車格數0格\,小型車格數28格\,機車格數0格\,腳踏車格數0格\,身心障礙汽車格數0格\,身心障礙機車格數0格,1,1,22.73028,120.34682,高雄市大社區區公所對面自強街,計次30元/6小時,0,1,0,2,0,0,0,0,0,0,0,0,0,0,0,0,0,1,0,0,0,1,0,Kaohsiung,KHH
100,華夏,15756996,大型車格數0格\,小型車格數36格\,機車格數0格\,腳踏車格數0格\,身心障礙汽車格數1格\,身心障礙機車格數0格,1,1,22.68093,120.30596,高雄市左營區華夏路、曾子路,計時15元/半小時,0,1,0,2,0,0,0,0,0,0,0,0,0,0,0,0,0,1,0,0,0,1,0,Kaohsiung,KHH
C05,正憲,15756996,大型車格數0格\,小型車格數42格\,機車格數0格\,腳踏車格數0格\,身心障礙汽車格數0格\,身心障礙機車格數0格,1,1,22.6371,120.3217,憲政路242巷&安康路20巷,計次30元/6小時,0,1,0,2,0,0,0,0,0,0,0,0,0,0,0,0,0,1,0,0,0,1,0,Kaohsiung,KHH
AD13,高雄民權停車場,97317757,大型車格數0格\,小型車格數479格\,機車格數0格\,腳踏車格數0格\,身心障礙汽車格數0格\,身心障礙機車格數0格,2,1,22.6083,120.31586,前鎮區泰山街1號B1-B3,每半小時15元，月票1\,200元,0,1,0,2,0,0,0,0,0,0,0,0,0,0,0,0,0,1,0,0,0,1,0,Kaohsiung,KHH
AD26,鳳山體育場停車場,15756996,大型車格數0格\,小型車格數0格\,機車格數0格\,腳踏車格數0格\,身心障礙汽車格數0格\,身心障礙機車格數0格,2,1,22.62331,120.35509,高雄市鳳山區立志街166號對面,,0,1,0,2,0,0,0,0,0,0,0,0,0,0,0,0,0,1,0,0,0,1,0,Kaohsiung,KHH
857d,龍鳳,15756996,大型車格數0格\,小型車格數30格\,機車格數0格\,腳踏車格數0格\,身心障礙汽車格數0格\,身心障礙機車格數0格,1,1,22.51344,120.35718,高雄市小港區龍鳳路、朝福街,計次30元/6小時,0,1,0,2,0,0,0,0,0,0,0,0,0,0,0,0,0,1,0,0,0,1,0,Kaohsiung,KHH
C41,松埔,15756996,大型車格數0格\,小型車格數22格\,機車格數0格\,腳踏車格數0格\,身心障礙汽車格數0格\,身心障礙機車格數0格,1,1,22.66076,120.38234,松埔路37巷8弄&松埔路37巷,不收費,0,1,0,2,0,0,0,0,0,0,0,0,0,0,0,0,0,1,0,0,0,1,0,Kaohsiung,KHH
AD25,光武國小地下立體停車場,80682490,大型車格數0格\,小型車格數128格\,機車格數0格\,腳踏車格數0格\,身心障礙汽車格數3格\,身心障礙機車格數0格,2,1,22.63961,120.33504,807高雄市三民區光武路35號,24小時計時收費,0,1,0,2,0,0,0,0,0,0,0,0,0,0,0,0,0,1,0,0,0,1,0,Kaohsiung,KHH
C38,果貿市場,12745271,大型車格數0格\,小型車格數13格\,機車格數0格\,腳踏車格數0格\,身心障礙汽車格數1格\,身心障礙機車格數0格,1,1,22.66835,120.28811,高雄市左營區翠華路與中華一路,計時30元/6小時,0,1,0,2,0,0,0,0,0,0,0,0,0,0,0,0,0,1,0,0,0,1,0,Kaohsiung,KHH
c08,林森,15756996,大型車格數0格\,小型車格數17格\,機車格數0格\,腳踏車格數0格\,身心障礙汽車格數1格\,身心障礙機車格數0格,1,1,23.08283,120.58804,A區：林森路70號旁。 B區：林森路75號旁。,不收費,0,1,0,2,0,0,0,0,0,0,0,0,0,0,0,0,0,1,0,0,0,1,0,Kaohsiung,KHH
C07,建國路,15756996,大型車格數0格\,小型車格數44格\,機車格數20格\,腳踏車格數0格\,身心障礙汽車格數1格\,身心障礙機車格數1格,1,1,22.63459,120.36487,高雄市鳳山區建國路一段&近經武路,計次30元/6小時,0,1,0,2,0,0,0,0,0,0,0,0,0,0,0,0,0,1,0,0,0,1,0,Kaohsiung,KHH
AD6,小港(立體),22763918,大型車格數0格\,小型車格數219格\,機車格數0格\,腳踏車格數0格\,身心障礙汽車格數0格\,身心障礙機車格數0格,2,1,22.56447,120.33752,高雄市小港區小港路175號,計時20元、月票1200元,0,1,0,2,0,0,0,0,0,0,0,0,0,0,0,0,0,1,0,0,0,1,0,Kaohsiung,KHH
AD15a,林園田中央,15756996,大型車格數0格\,小型車格數45格\,機車格數0格\,腳踏車格數0格\,身心障礙汽車格數0格\,身心障礙機車格數0格,1,1,22.50123,120.38905,高雄市林園區東林西路249巷,不收費,0,1,0,2,0,0,0,0,0,0,0,0,0,0,0,0,0,1,0,0,0,1,0,Kaohsiung,KHH
812a,錦田機車,15756996,大型車格數0格\,小型車格數0格\,機車格數124格\,腳踏車格數0格\,身心障礙汽車格數0格\,身心障礙機車格數0格,1,1,22.63148,120.31019,高雄市新興區中正三路、錦田路口,不收費,0,1,0,2,0,0,0,0,0,0,0,0,0,0,0,0,0,1,0,0,0,1,0,Kaohsiung,KHH
A01,德中,15756996,大型車格數0格\,小型車格數24格\,機車格數0格\,腳踏車格數0格\,身心障礙汽車格數0格\,身心障礙機車格數0格,1,1,22.72181,120.27731,高雄市楠梓區德中路73巷─大學33街,計次30元/6小時,0,1,0,2,0,0,0,0,0,0,0,0,0,0,0,0,0,1,0,0,0,1,0,Kaohsiung,KHH
B38,明義,15756996,大型車格數0格\,小型車格數32格\,機車格數0格\,腳踏車格數0格\,身心障礙汽車格數1格\,身心障礙機車格數0格,254,1,22.57661,120.32431,高雄市前鎮區草衙二路與中平路,計時15元/半小時,0,1,0,2,0,0,0,0,0,0,0,0,0,0,0,0,0,1,0,0,0,1,0,Kaohsiung,KHH
460,蚵仔寮（A區）,12745271,大型車格數0格\,小型車格數94格\,機車格數72格\,腳踏車格數0格\,身心障礙汽車格數0格\,身心障礙機車格數0格,1,1,22.72743,120.25533,高雄市梓官區漁港一路、港七街(漁市場對面),計時15元/半小時,0,1,0,2,0,0,0,0,0,0,0,0,0,0,0,0,0,1,0,0,0,1,0,Kaohsiung,KHH
970,苓中,12681939,大型車格數0格\,小型車格數69格\,機車格數0格\,腳踏車格數0格\,身心障礙汽車格數0格\,身心障礙機車格數0格,1,1,22.61904,120.30512,高雄市苓雅區苓雅一路、文橫二路口,平日:計時15元/半小時；假日:計時20元/半小時,0,1,0,2,0,0,0,0,0,0,0,0,0,0,0,0,0,1,0,0,0,1,0,Kaohsiung,KHH
460c,蚵仔寮（C區）,15756996,大型車格數0格\,小型車格數6格\,機車格數0格\,腳踏車格數0格\,身心障礙汽車格數0格\,身心障礙機車格數0格,1,1,22.73023,120.26002,嘉好路26巷魚塭旁,不收費,0,1,0,2,0,0,0,0,0,0,0,0,0,0,0,0,0,1,0,0,0,1,0,Kaohsiung,KHH
757,旗山轉運站,50885758,大型車格數0格\,小型車格數15格\,機車格數177格\,腳踏車格數20格\,身心障礙汽車格數0格\,身心障礙機車格數0格,1,1,22.88421,120.48472,高雄市旗山區旗山轉運站旁,小型車計次(30元/6小時)；機車10元/日,0,1,0,2,0,0,0,0,0,0,0,0,0,0,0,0,0,1,0,0,0,1,0,Kaohsiung,KHH
520,臥龍,12745271,大型車格數0格\,小型車格數28格\,機車格數0格\,腳踏車格數0格\,身心障礙汽車格數0格\,身心障礙機車格數0格,1,1,22.63863,120.33,高雄市三民區九如一路、臥龍路,計時15元/半小時,0,1,0,2,0,0,0,0,0,0,0,0,0,0,0,0,0,1,0,0,0,1,0,Kaohsiung,KHH
