041,忠信地下停車場,21101573,立體式小型車314格(含身心障礙停車位7格)。立體式機車255格(含身心障礙停車位5格)。,255,255,25.04041,121.56778,松仁路2號地下,小型車計時40元，全日月票5200元，日間月票3600元(7-19)，夜間月票2880元(19-8) 機車計時10元(當日當次最高收費上限20元，隔日另計)，月票300元；本場實施差別費率，停放於電動車格之車輛，依該場停車費率每小時加收10元，未充電者每小時再加收10元(合計每小時加收20元)。10月21-22、28-29，11月4-5、11-12、18-19每日10時至20時小型車每小時60元,0,1,0,2,1,0,0,0,0,0,0,0,0,0,0,0,0,0,0,0,0,0,0,Taipei,TPE
022,五分埔公園地下停車場,21101573,立體式小型車210格(含身心障礙停車位4格)。,255,255,25.04662,121.58044,中坡北路57號地下,全日月票4000元，所在里里民全日月票3500元，夜間月票3000元(限19-8)，周一至周四計時40元，周五至周日及政府行政機關放假之紀念日及民俗日計時50元；本場實施差別費率，停放於電動車格之車輛，依該場停車費率每小時加收10元，未充電者每小時再加收10元(合計每小時加收20元)。,0,1,0,2,1,0,0,0,0,0,0,0,0,0,0,0,0,0,0,0,0,0,0,Taipei,TPE
062,忠孝玉成停車場,21101573,大型車:0格，小型車:49格，機車:0格,255,255,25.046,121.58377,玉成段五小段234-1、234-3、258、258-1、258-2地號；忠孝東路6段62號旁空地,計時：150元/時，停車未滿1小時以1小時計；逾1小時以上者，未滿半小時以半小時計。月租：8\,000元/月。,0,0,0,2,1,0,0,0,0,0,0,0,0,0,0,0,0,0,0,0,0,0,0,Taipei,TPE
090,萬板地下停車場,21101573,立體式小型車180格(含身心障礙停車位4格)。,255,255,99.99999,25.02863,艋舺大道462號地下,計時30元，全日月票5200元，日間月票3600元(7-19) ,0,1,0,2,1,0,0,0,0,0,0,0,0,0,0,0,0,0,0,0,0,0,0,Taipei,TPE
028,松山高中地下停車場,21101573,立體式小型車226格(含身心障礙停車位5格)。,255,255,25.04407,121.56407,基隆路1段156號地下,配合2/1-2/19台灣燈會期間費率調整為，周一至周五17-22時，週六至周日與行政機關放假之紀念日與民俗日10時至22時，調整小型車費率，計時60元，其餘時段維持原費率。全日月票5760元(全日里民優惠月票4600元) 平日：(0-8)計時10元，(8-20)計時30元，(20-24)計時10元 假日(含行政機關放假日、調整放假日、民俗日)：(9-19)計時60元，其餘時段同平日費率 ；本場實施,0,1,0,2,1,0,0,0,0,0,0,0,0,0,0,0,0,0,0,0,0,0,0,Taipei,TPE
119,大龍國小地下停車場,21101573,立體式小型車265格(含身心障礙停車位6格)。立體式機車106格(含身心障礙停車位3格)。,255,255,25.07412,121.51664,哈密街47號地下,周一至周五小型車計時30元，周六、日與行政機關放假之紀念日、民俗節日小型車計時40元。全日月票4800元，停車場所在里民全日月票3000元，ㄧ般里民全日月票3500元，日間月票2000元(限周一至周五7-19，周六、日與行政機關放假之紀念日、民俗節日不得使用)，夜間月票2400元(限每日19-8，不含假日白天) 機車計次20元；月票300元；本場實施差別費率，停放於電動車格之車輛，依該場停車費率每,0,1,0,2,1,0,0,0,0,0,0,0,0,0,0,0,0,0,0,0,0,0,0,Taipei,TPE
055,市民大道(塔城段),21101573,大型車0格、小型車252格、機車0格,255,255,25.05034,121.50927,,(8-20)計時20元 (20-8)計時10元 日間月票2400元(7-19，以80張為出售上限，每人限購1張)，夜間月票500元(18-9及周六、日與行政機關放假之紀念日、民俗節日使用),0,0,0,2,1,0,0,0,0,0,0,0,0,0,0,0,0,0,0,0,0,0,0,Taipei,TPE
040,健康國小地下停車場,21101573,立體式小型車195格(含身心障礙停車位5格)。,255,255,25.05653,121.56235,延壽街168號地下,計時：30元/時，全程以半小時計費。月租：全日月票5\,250元/月。,0,1,0,2,1,0,0,0,0,0,0,0,0,0,0,0,0,0,0,0,0,0,0,Taipei,TPE
002,松壽廣場地下停車場,21101573,立體式小型車446格(含身心障礙停車位6格)。,255,255,25.03714,121.56628,松智路15號地下,計時：30元/時(周一至周五9-22)、40元/時(周六至周日與行政機關放假之紀念日與民俗日9-22)、10元/時(每日22-9)，全程半小時計費。 月租：全日月票3\,400元/月、日間月票2\,400元/月(每日7-20)、夜間月票1\,000元/月(每日19-8)。10月21-22、28-29，11月4-5、11-12、18-19每日10時至20時小型車每小時60元,0,1,0,2,1,0,0,0,0,0,0,0,0,0,0,0,0,0,0,0,0,0,0,Taipei,TPE
074,偶戲博物館地下停車場,21101573,為立體、地下停車場，計有69個小型車停車位。45個機車停車位,255,255,25.04728,121.56206,市民大道5段99號(地下一層),計時：小型車週一至週五30元/時，週六至週日、政府行政機關放假之紀念日、民俗節日及政府機關彈性調整放假日40元/時，機車週一至週日10元/時，當日當次收費上限20元(隔日另計)，全程以半小時計費。月租：全日5\,400元/月，機車全日300元/月。,0,1,0,2,1,0,0,0,0,0,0,0,0,0,0,0,0,0,0,0,0,0,0,Taipei,TPE
718,青年一期社會住宅地下停車場,21101573,建物附設一般平面式小型車132格[含身心障礙停車位4格，孕婦、育有6歲以下兒童停車位3格]。建物附設一般平面式機車160格[含身心障礙停車位4格]。,255,255,25.02026,121.50346,,計時：小型車30元/時，全程以半小時計費。月租：小型車全日4\,800元/月，機車全日300元/月。,0,0,0,2,1,0,0,0,0,0,0,0,0,0,0,0,0,0,0,0,0,0,0,Taipei,TPE
058,市民大道(中林段),21101573,立體式小型車496格(含身心障礙停車位10格)。,255,255,25.0479,121.52273,中山北路-林森北路(地下),計時：30元/時[周一至周五09-18]，20元/時[周一至周五18-09]，周六至周日及政府行政機關放假之紀念日及彈性調整放假日、民俗節日20元/時；全程半小時計費。月租：全日3\,600元/月。,0,1,0,2,1,0,0,0,0,0,0,0,0,0,0,0,0,0,0,0,0,0,0,Taipei,TPE
053,民生立體停車場,21101573,立體式小型車457格(含身心障礙停車位10格)。,255,255,25.05834,121.55946,民生東路5段84號,計時30元，全日月票5760元(全日里民優惠月票4600元)；本場實施差別費率，停放於電動車格之車輛，依該場停車費率每小時加收10元，未充電者每小時再加收10元(合計每小時加收20元)。,0,1,0,2,1,0,0,0,0,0,0,0,0,0,0,0,0,0,0,0,0,0,0,Taipei,TPE
100,臺北榮民總醫院地面停車場,21101573,大型車:0格，小型車:323格，機車:0格,255,255,25.12113,121.52016,石牌路2段201號,計時：40元/時，夜間20元/時(23-翌日07)，進場未滿30分鐘免費，停車未滿1小時以1小時計，逾1小時以上者，未滿半小時以半小時計。,0,0,0,2,1,0,0,0,0,0,0,0,0,0,0,0,0,0,0,0,0,0,0,Taipei,TPE
188,松山車站地下停車場,21101573,立體式小型車431格(含身心障礙停車位16格)。,255,255,25.04849,121.57831,松山路11號地下,周一至周四計時40元，周五至周日與行政機關放假之紀念日、民俗日計時50元(當日當次收費上限300元，隔日另計) 全日月票5500元，日間月票3600元(7-19) ；本場實施差別費率，停放於電動車格之車輛，依該場停車費率每小時加收10元，未充電者每小時再加收10元(合計每小時加收20元)。,0,1,0,2,1,0,0,0,0,0,0,0,0,0,0,0,0,0,0,0,0,0,0,Taipei,TPE
106,蓬萊國小地下停車場,21101573,建物附設立體式小型車286格(含身心障礙停車位6格，孕婦、育有6歲以下兒童停車位7格)。建物附設立體式機車144格(含身心障礙停車位3格)。,255,255,25.05643,121.51608,,計時：小型車40元/時(16-22)；30元/時(22-翌日16)；機車10元/時，當日最高收費上限20元(隔日另計)，全程以半小時計費。月租：小型車全日5\,760元，機車300元/月。,0,1,0,2,1,0,0,0,0,0,0,0,0,0,0,0,0,0,0,0,0,0,0,Taipei,TPE
768,興隆公宅D1停車場,21101573,建物附設立體式小型車128格(含身心障礙停車格4格\,孕婦、育有六歲以下兒童停車位3格)。建物附設立體式機車114格(含身心障礙停車位4格)。,255,255,24.98833,121.55792,,小型車20元/時，全程以半小時計費。月租：小型車全日3\,500元/月，全日里民優惠2\,600/月(華興里，樟林里、明興里)，所在地里全日里民優惠2\,400/月(明義里)；機車全日300元/日,0,0,0,2,1,0,0,0,0,0,0,0,0,0,0,0,0,0,0,0,0,0,0,Taipei,TPE
105,玉成國小地下停車場,21101573,大型車0格、小型車285格、機車25格,255,255,25.0532,121.5928,,小型車計時30元(8-18)，計時20元(18-8)， 全日月票2500元，日間月票2000元(8-20) 機車計次20元；月票300元；本場實施差別費率，停放於電動車格之車輛，依該場停車費率每小時加收10元，未充電者每小時再加收10元(合計每小時加收20元)。,0,1,0,2,1,0,0,0,0,0,0,0,0,0,0,0,0,0,0,0,0,0,0,Taipei,TPE
124,社子國小地下停車場,21101573,立體式小型車464格(含身心障礙停車位10格)。立體式機車213格(含身心障礙停車位5格)。,255,255,25.09097,121.50256,延平北路6段308號地下,一、計時：小型車20元/時，全程以半小時計費。二、計次：機車：20元/次，隔日另計。三、月租：全日3\,500元/月，日間(8時-18時)2\,000元/月，夜間(19時-8時)1\,800元/月； 機車：全日300元/月。所在里民全日月票3000元,0,1,0,2,1,0,0,0,0,0,0,0,0,0,0,0,0,0,0,0,0,0,0,Taipei,TPE
667,木柵社會住宅地下停車場,21101573,建物附設立體式小型車92(含身心障礙停車位2格，孕婦、育有6歲以下兒童停車位2格)。建物附設立體式機車99格(含身心障礙停車位2格)。,255,255,24.98918,121.56642,,,0,0,0,2,1,0,0,0,0,0,0,0,0,0,0,0,0,0,0,0,0,0,0,Taipei,TPE
001,府前廣場地下停車場,21101573,大型車:0格，小型車:1998格，機車:1337格,255,255,25.03657,121.56209,松壽路1號地下,小型車全日月票4200元，夜間月票1000元(限周一至周五19-8，及周六、日與行政機關放假之紀念日、民俗日)，小型車計時30元(9-18)，夜間計時10元(18-9)；機車計時10元(當日當次上限20元)，機車月票300元。10月21-22、28-29，11月4-5、11-12、18-19每日10時至20時小型車每小時60元,0,0,0,2,1,0,0,0,0,0,0,0,0,0,0,0,0,0,0,0,0,0,0,Taipei,TPE
114,景美國小地下停車場,21101573,大型車1格、小型車253格、機車93格,255,255,24.9885,121.54034,,小型車計時20元，全日月票4800元，日間月票2000元(7-19)，夜間月票1200元(19-8)，為鼓勵民眾停車所在里全日月票、里民全日月票均以3000元優惠促銷 機車計次20元；月票300元；本場實施差別費率，停放於電動車格之車輛，依該場停車費率每小時加收10元，未充電者每小時再加收10元(合計每小時加收20元)。,0,1,0,2,1,0,0,0,0,0,0,0,0,0,0,0,0,0,0,0,0,0,0,Taipei,TPE
129,西康地下停車場,21101573,建物附設立體式小型車86格[含身心障礙停車位2格，孕婦、育有6歲以下兒童停車位2格]。,255,255,25.08472,121.56375,內湖路1段203巷25號地下,計時：20元/時，停放於充電格位之車輛每小時加收10元；依設備自動判斷未充電者每小時再加收10元[未充電者和合計每小時加收20元]，全程以半小時計。月租：全日4\,800元/月。；本場實施差別費率，停放於電動車格之車輛，依該場停車費率每小時加收10元，未充電者每小時再加收10元(合計每小時加收20元)。,0,0,0,2,1,0,0,0,0,0,0,0,0,0,0,0,0,0,0,0,0,0,0,Taipei,TPE
081,康樂立體停車場,21101573,大型車:0格，小型車:150格，機車:0格,255,255,25.07211,121.61911,康樂路138號,計時：30元/時，全程以半小時計費。月租：全日4\,000元/月。,0,1,0,2,1,0,0,0,0,0,0,0,0,0,0,0,0,0,0,0,0,0,0,Taipei,TPE
714,瑞光社會住宅地下停車場,21101573,小型車194格(含身障格位9格)，機車278格(含身障格位10格),255,255,25.0734,121.5791,,計時:小型車20元/時，全程以半小時計費。機車10元/時，當日最高20元(隔日另計)。月租:小型車3\,000元月；機車300元/月。,0,0,0,2,1,0,0,0,0,0,0,0,0,0,0,0,0,0,0,0,0,0,0,Taipei,TPE
103,南港國小地下停車場,21101573,立體式小型車311格(含身心障礙停車位8格)。立體式機車71格(含身心障礙停車位6格)。,255,255,25.05712,121.61109,興東街59號地下1樓,小型車周一至周五(8-20)計時30元，(20-8)計時20元 周六至周日及政府行政機關放假之紀念日及民俗日計時20元 全日月票4800元，停車場所在里及一般里民全日月票均為3000元。日間月票3500元(8-20)，夜間月票1000元(19-8及周、六日與行政機關放假之紀念日、民俗日使用) 機車計次20元；月票300元；本場實施差別費率，停放於電動車格之車輛，依該場停車費率每小時加收10元，未充,0,1,0,2,1,0,0,0,0,0,0,0,0,0,0,0,0,0,0,0,0,0,0,Taipei,TPE
760,延平國小地下停車場,21101573,建物附設立體式小型車309(含身心障礙停車位7格，孕婦、育有6歲以下兒童停車位7格)。建物附設立體式機車99格(含身心障礙停車位2格)。,255,255,25.0666,121.51236,,小型車(欲享停車優惠之車主須持所需證件至停車管理室登陸車牌號碼，始享有計時停車優惠，未完成驗證者，費率一律以每小時新台幣30元計算):(1)停放1-16小時:甲、一般民眾計時30元(最高160)，乙、鄰近里民計時24元(最高100元)，丙、所在里民計時21元(最高80元)，身心障礙者計時15元(最高60元)，(2)停放17小時起:一般民眾計時30元、鄰近里民計時12元、所在里民計時10元、身心障礙,0,0,0,2,1,0,0,0,0,0,0,0,0,0,0,0,0,0,0,0,0,0,0,Taipei,TPE
640,萬華車站地下停車場,21101573,建物附設立體式小型車297(含身心障礙停車位6格，孕婦、育有6歲以下兒童停車位6格)。,255,255,25.03389,121.50055,萬華車站前廣場地下,一到五每小時30元，假日每小時40元 全日月票4800元，優惠里3840元，所在里3360元。,0,1,0,2,1,0,0,0,0,0,0,0,0,0,0,0,0,0,0,0,0,0,0,Taipei,TPE
187,松山工農地下停車場,21101573,立體式小型車239格(含身心障礙停車位5格)。立體式機車189格(含身心障礙停車位4格)。,255,255,25.03958,121.57229,忠孝東路5段236巷15號地下,小型車全日月票5200元 小型車周一至周五計時30元，周六、日與行政機關放假之紀念日與民俗日計時40元 機車計時10元(當日當次最高收費上限20元，隔日另計)，月票300元；本場實施差別費率，停放於電動車格之車輛，依該場停車費率每小時加收10元，未充電者每小時再加收10元(合計每小時加收20元)。,0,1,0,2,1,0,0,0,0,0,0,0,0,0,0,0,0,0,0,0,0,0,0,Taipei,TPE
128,萬興國小地下停車場,21101573,大型車0格、小型車226格、機車184格,255,255,24.9899,121.57625,,周一至周五小型車計時20元(週六及周日與行政機關放假之紀念日、民俗日8時至20時每小時30元，20時至翌日上午8時每小時20元)，全日月票3500元，停車場所在里全日月票2500元，一般里民全日月票3000元，日間月票1800元(8-20)，夜間月票2000元(限周一至周五20-8及周六、日與行政機關放假之紀念日、民俗日使用)；機車計次20元，機車月票300元。；本場實施差別費率，停放於電動車格之,0,1,0,2,1,0,0,0,0,0,0,0,0,0,0,0,0,0,0,0,0,0,0,Taipei,TPE
102,承德公園地下停車場,21101573,大型車:2格，小型車:176格，機車:60格,255,255,25.08978,121.52199,基河路150號地下,小型車周一至周四(0-9)計時10元，(9-22)計時40元，(22-24)計時10元，周五至周日及政府行政機關放假之紀念日與民俗日(0-8)計時10元，(8-12)計時30元，(12-24)計時50元 全日月票4800元，日間月票2000元(7-19) 機車計次20元；月票300元；大型重機全日月票2400元(2格),0,0,0,2,1,0,0,0,0,0,0,0,0,0,0,0,0,0,0,0,0,0,0,Taipei,TPE
089,春光公園地下停車場,21101573,大型車:0格，小型車:209格，機車:65格,255,255,25.04224,121.58069,忠孝東路5段666號地下,計時：小型車30元/時、機車10元/時(當日當次最高收費上限20元，隔日另計)，全程以半小時計費。 月租：小型車全日6\,000元/月、日間3\,600元/月(07-19)、夜間3\,600元/月(19-08)； 機車300元/月。 停放於充電格位之車輛，每小時加收10元，依設備自動判斷未充電者每小時再加10元(未充電者合計每小時加收20元)。,0,1,0,2,1,0,0,0,0,0,0,0,0,0,0,0,0,0,0,0,0,0,0,Taipei,TPE
031,附中公園地下停車場,21101573,大型車0格、小型車114格、機車0格,255,255,25.0362,121.54246,,計時：50元/時(08-21)，10元/時(21-08)，全程以半小時計費。月租：全日月票5\,760元/月。；本場實施差別費率，停放於電動車格之車輛，依該場停車費率每小時加收10元，未充電者每小時再加收10元(合計每小時加收20元)。,0,1,0,2,1,0,0,0,0,0,0,0,0,0,0,0,0,0,0,0,0,0,0,Taipei,TPE
019,塔城公園地下停車場,21101573,立體式小型車151格(含身心障礙停車位4格)。,255,255,25.05081,121.51098,塔城街11號地下,全日月票5760元(全日里民優惠月票4600元)，夜間月票3000元(21-8)，計時30元；本場實施差別費率，停放於電動車格之車輛，依該場停車費率每小時加收10元，未充電者每小時再加收10元(合計每小時加收20元)。,0,1,0,2,1,0,0,0,0,0,0,0,0,0,0,0,0,0,0,0,0,0,0,Taipei,TPE
092,濱江國中地下停車場,21101573,為地下停車場，計有209個小型車格，135個機車格。,255,255,25.07949,121.56163,樂群2路266巷1號地下,計時：小型車20元(8-18)；10元(18-8)，每晚最高收費30元， 機車10元/時，當日當次最高收費上限20元(跨越每日零時重新計算)全程以半小時計費。月租：小型車全日月票2500元，日間月票1500元(7-20)，夜間月票500元(18-8)，機車月票300元 。,0,1,0,2,1,0,0,0,0,0,0,0,0,0,0,0,0,0,0,0,0,0,0,Taipei,TPE
052,民生社區活動中心地下停車場,21101573,為地下停車場，計有155個小型車格,255,255,25.05976,121.56269,民生東路5段163號之1號地下2、3F層,計時：30元/時，全程以半小時計費。月租：全日5\,760元/月。,0,1,0,2,1,0,0,0,0,0,0,0,0,0,0,0,0,0,0,0,0,0,0,Taipei,TPE
783,小彎社會住宅地下停車場,21101573,大型車0格；小型車237格；機車346格,255,255,25.05733,121.59432,,計時:小型車30元/時，機車10元/時(當日當次上限20元，隔日另計)，全程以半小時計。月票:小型車3\,000元/月，機車300元/月。,0,0,0,2,1,0,0,0,0,0,0,0,0,0,0,0,0,0,0,0,0,0,0,Taipei,TPE
111,蘭雅公園地下停車場,21101573,立體式小型車155格(含身心障礙停車位4格)。,255,255,25.10976,121.52895,德行東路129巷31號地下,全日月票5200元 周一至周五計時30元 周六、日與行政機關放假之紀念日、民俗日計時40元；本場實施差別費率，停放於電動車格之車輛，依該場停車費率每小時加收10元，未充電者每小時再加收10元(合計每小時加收20元)。,0,1,0,2,1,0,0,0,0,0,0,0,0,0,0,0,0,0,0,0,0,0,0,Taipei,TPE
021,前港公園地下停車場,21101573,立體式小型車531格(含身心障礙停車位11格)。,255,255,25.08537,121.52028,前港街45號地下,全日月票5200元，日間月票2600元(7-19) (2-19)計時20元，(19-2)計時40元；本場實施差別費率，停放於電動車格之車輛，依該場停車費率每小時加收10元，未充電者每小時再加收10元(合計每小時加收20元)。,0,1,0,2,1,0,0,0,0,0,0,0,0,0,0,0,0,0,0,0,0,0,0,Taipei,TPE
784,廣慈社會住宅1區地下停車場,21101573,大型車0格；小型車369格；機車178格,255,255,25.03969,121.58287,,計時:小型車30元/時、機車10元/時(當日當次最高上限20元)，全程以半小時計費。月租:小型車全日4\,800元/月、機車全日300元/月,0,0,0,2,1,0,0,0,0,0,0,0,0,0,0,0,0,0,0,0,0,0,0,Taipei,TPE
033,進安公園地下停車場,21101573,為地下三層停車場，計有150個小型車停車格,255,255,25.04611,121.5377,八德路2段158號地下,計時：20元/時，全程以半小時計費。月租：全日4\,800元/月，日間3\,000元/月(07-20)，夜間2\,000元/月(20-07)。,0,1,0,2,1,0,0,0,0,0,0,0,0,0,0,0,0,0,0,0,0,0,0,Taipei,TPE
165,玉成公園地下停車場,21101573,立體式小型車412格(含身心障礙停車位9格)。立體式機車83格(含身心障礙停車位3格)。,255,255,25.04212,121.58701,,小型車計時20元，全日月票4800元，夜間月票2400元(限周一至周五每日19-8及周六、日與行政機關放假之紀念日、民俗日使用) 機車計次20元；月票300元；本場實施差別費率，停放於電動車格之車輛，依該場停車費率每小時加收10元，未充電者每小時再加收10元(合計每小時加收20元)。,0,1,0,2,1,0,0,0,0,0,0,0,0,0,0,0,0,0,0,0,0,0,0,Taipei,TPE
035,成淵高中地下停車場,21101573,大型車0格、小型車265格、機車0格,255,255,25.06048,121.51999,,全日月票5760元(全日里民優惠月票4600元)，夜間月票2400元(19-8) (9-21)計時40元，(21-9)計時30元；本場實施差別費率，停放於電動車格之車輛，依該場停車費率每小時加收10元，未充電者每小時再加收10元(合計每小時加收20元)。,0,1,0,2,1,0,0,0,0,0,0,0,0,0,0,0,0,0,0,0,0,0,0,Taipei,TPE
086,振興公園地下停車場,21101573,大型車:0格，小型車:210格，機車:102格,255,255,25.11859,121.52352,天母西路112號地下,小型車全日月票4200元，夜間月票2000元(19-8)，(8-23)計時40元，(23-8)計時20元 機車計時10元(當日當次最高收費上限30元，隔日另計)，月票300元,0,0,0,2,1,0,0,0,0,0,0,0,0,0,0,0,0,0,0,0,0,0,0,Taipei,TPE
016,中山堂地下停車場,21101573,立體式小型車440格(含身心障礙停車位9格)。,255,255,25.04401,121.51045,延平南路98號地下,計時：周一至周五計時40元(08-20)，計時10元(20-08)，周六日及政府行政機關放假之紀念日與民俗節日計時40元(10-20)，計時10元(20-10)。月租：全日月票4800元，日間月票3600元(07-19)，夜間月票1000元(19-08) 。,0,1,0,2,1,0,0,0,0,0,0,0,0,0,0,0,0,0,0,0,0,0,0,Taipei,TPE
070,榮星花園地下停車場,21101573,立體式小型車242格(含身心障礙停車位5格)。立體式機車67格(含身心障礙停車位2格)。,255,255,25.06388,121.5396,建國北路3段39號地下,計時：小型車40元/時；機車10元/時，當日當次最高上限20元(凡跨越每日凌晨零時重新計算)；全程半小時計算，月租：小型車全日月票5\,400元/月；機車全日月票300元/月。,0,1,0,2,1,0,0,0,0,0,0,0,0,0,0,0,0,0,0,0,0,0,0,Taipei,TPE
005,立農公園地下停車場,21101573,大型車:0格，小型車:199格，機車:93格,255,255,25.11843,121.50356,承德路7段372號地下,小型車計時30元，全日月票4800元，日間月票2800元(7-19)，夜間月票2000元(19-8)，所在里里民全日月票3360元，一般里民全日月票3600元 機車計次20元；月票300元；本場實施差別費率，停放於電動車格之車輛，依該場停車費率每小時加收10元，未充電者每小時再加收10元(合計每小時加收20元)。,0,1,0,2,1,0,0,0,0,0,0,0,0,0,0,0,0,0,0,0,0,0,0,Taipei,TPE
014,興雅國中地下停車場,21101573,立體式小型車447格(含身心障礙停車位9格)。,255,255,25.0349,121.57281,松德路200巷18號地下,計時30元，全日月票4800元，日間月票2800元(7-19)，夜間月票2000元(限19-8),0,1,0,2,1,0,0,0,0,0,0,0,0,0,0,0,0,0,0,0,0,0,0,Taipei,TPE
015,峨眉立體停車場,21101573,建物附設立體式小型車518格(含身心障礙停車位11格，孕婦、育有6歲以下兒童停車位11格)。建物附設立體式機車1653格(含身心障礙停車位12格)。,255,255,25.04403,121.50538,峨眉街83號,計時：小型車周一至周五(10-22)50元/時、(22-10)10元/時；小型車周六、周日與行政機關放假之紀念日與民俗日(10-24)60元/時、(24-10)10元/時，全程以半小時計費。月租：小型車全日月票4\,800元/月，日間月票4\,000元/月(每日10-22)，夜間月票500元/月(每日21-9)；機車全日月票300元/月。計次：機車20元/次，隔日另計。,0,1,0,2,1,0,0,0,0,0,0,0,0,0,0,0,0,0,0,0,0,0,0,Taipei,TPE
044,青年公園高爾夫球場地下停車場,21101573,大型車0格、小型車319格、機車150格,255,255,25.02485,121.50734,,小型車全日月票4800元，夜間月票2400元(18-8)，計時30元 機車計次20元；月票300元；本場實施差別費率，停放於電動車格之車輛，依該場停車費率每小時加收10元，未充電者每小時再加收10元(合計每小時加收20元)。,0,1,0,2,1,0,0,0,0,0,0,0,0,0,0,0,0,0,0,0,0,0,0,Taipei,TPE
029,東湖國小地下停車場,21101573,立體式小型車358格(含身心障礙停車位7格)。立體式機車109格(含身心障礙停車位2格)。,255,255,25.06854,121.61569,東湖路115號之1地下,小型車計時40元(8-21)，計時20元(21-8)，日間月票2000元(7-19)，夜間月票2000元(19-8)，全日月票4000元，所在里及一般里民優惠全日月票2800元 機車計次20元；月票300元；本場實施差別費率，停放於電動車格之車輛，依該場停車費率每小時加收10元，未充電者每小時再加收10元(合計每小時加收20元)。,0,1,0,2,1,0,0,0,0,0,0,0,0,0,0,0,0,0,0,0,0,0,0,Taipei,TPE
